Address,Content Type,Page Title,Meta Description,Main Text
https://example.com/personal/loans,text/html,Personal Loans,Find the best personal loans,Apply for a personal loan online.
https://example.com/personal/credit-cards,text/html,Credit Cards,Compare credit cards,Choose the best credit card for you.
https://example.com/business/loans,text/html,Business Loans,Loans for businesses,Get funding for your business.
https://example.com/business/insurance,text/html,Business Insurance,Protect your business,Find the right insurance plan.
https://example.com/about,text/html,About Us,Learn about our company,We are a leading provider of financial services.
https://example.com/contact,text/html,Contact Us,Contact our team,Reach out to us for support.
